<commands
	xmlns:xsi="http://www.w3.org/2001/XMLSchema-instance"
	xsi:noNamespaceSchemaLocation="part1in.xsd"
	spatialWidth="256"
	spatialHeight="256"
	>
 <createCity name="S" x="2" y="1" radius="1" color="red"/> 
 <createCity name="T" x="4" y="4" radius="1"  color="orange"/>
 <createCity name="Y" x="6" y="3" radius="1"  color="blue"/>
 <createCity name="X" x="4" y="0" radius="1"  color="purple"/>
 <createCity name="Z" x="2" y="4" radius="1"  color="black"/>
 <createCity name="A" x="3" y="2" radius="24"  color="green"/>
 <listCities sortBy="name"/> 
</commands>
